<?xml version="1.0" encoding="UTF-8" standalone="yes"?>
<story xmlns:xsi="http://www.w3.org/2001/XMLSchema-instance"
    xsi:noNamespaceSchemaLocation="../../../story.xsd">
    <characters>
        <character position="1" id="1" name="clerik" description="clerik_desc" skillBased="SKILL_POWER">
            <skills>
                <ref value="heal"/>
                <ref value="greater_heal"/>
                <ref value="heal_overtime_and_cancel"/>
                <ref value="heal_and_heal_overtime"/>
                
                <ref value="life"/>
                <ref value="quick"/>
                <ref value="reflect"/>
                <ref value="posion_dagger"/>
            </skills>
            <primaryStat>skillpower</primaryStat>
            <health>50</health>
            <defense>3</defense>
            <skill>3</skill>
            <luck>3</luck>
            <attack>5</attack>
            <baseDamage>1</baseDamage>
            <skillPower>10</skillPower>
        </character>
    </characters>
</story>
