<?xml version="1.0" encoding="UTF-8"?>
<story xmlns:xsi="http://www.w3.org/2001/XMLSchema-instance"
    xsi:noNamespaceSchemaLocation="../story.xsd">
    <characters>
        <character position="1" id="1" name="ch_soldier" description="dsc_soldier">
            <health>15</health>
            <defense>5</defense>
            <skill>2</skill>
            <luck>1</luck>
            <attack>7</attack>   
        </character>
        <character position="" id="2" name="ch_doctor" description="dsc_doctor">
            <health>25</health>
            <defense>2</defense>
            <skill>1</skill>
            <luck>1</luck>
            <attack>7</attack>
        </character>
        <character position="" id="3" name="ch_policeman" description="dsc_policeman">
            <health>15</health>
            <defense>2</defense>
            <skill>5</skill>
            <luck>1</luck>
            <attack>7</attack>
        </character>
        <character position="" id="4" name="ch_homeless" description="dsc_homeless">
            <health>10</health>
            <defense>1</defense>
            <skill>2</skill>
            <luck>8</luck>
            <attack>7</attack>
        </character>
    </characters>
</story>