<?xml version="1.0" encoding="UTF-8"?>
<story xmlns:xsi="http://www.w3.org/2001/XMLSchema-instance"
    xsi:noNamespaceSchemaLocation="../../story.xsd">
    <enemies>
        <enemy name="e_rotten_merchant" id="rotten_merchant">
           <health>20</health>
           <defense>3</defense>
           <skill>2</skill>
           <luck>3</luck>
           <attack>7</attack>
       </enemy>
    </enemies>
</story>