<?xml version="1.0" encoding="UTF-8"?>
<story xmlns:xsi="http://www.w3.org/2001/XMLSchema-instance"
    xsi:noNamespaceSchemaLocation="../../GameBook/assets/template/story.xsd" name="@string/story_zombie_apocalypse">
    <characters>
        <character position="1" id="1" name="@string/story1_ch_soldier" description="@string/story1_dsc_soldier">
            <health>20</health>
            <defense>5</defense>
            <skill>2</skill>
            <luck>1</luck>
        </character>
        <character position="0" id="2" name="@string/story1_ch_doctor" description="@string/story1_dsc_doctor">
            <health>35</health>
            <defense>3</defense>
            <skill>2</skill>
            <luck>2</luck>
        </character>
        <character position="0" id="3" name="@string/story1_ch_policeman" description="@string/story1_dsc_policeman">
            <health>20</health>
            <defense>3</defense>
            <skill>5</skill>
            <luck>2</luck>
        </character>
        <character position="0" id="4" name="@string/story1_ch_homeless" description="@string/story1_dsc_homeless">
            <health>25</health>
            <defense>2</defense>
            <skill>2</skill>
            <luck>8</luck>
        </character>
    </characters>
    <sections>
        <section position="1" text="@string/story1_section1_text">
            <options>
                <option section="2" text="@string/story1_section1_option1_text"/>
                <option section="" text="@string/story1_section1_option2_text"/>
                <option section="" text="@string/story1_section1_option3_text"/>
            </options>
        </section>
        <section position="2" text="@string/story1_section2_text" enemiesDefeatedText="@string/story1_section2_enemy_text" luckText="@string/story1_section2_luck_text">
            <enemies>
                <enemy attack="6" skill="2" name="@string/story1_e_livingdead" />
            </enemies>
            <options>
                <option section="4" text="@string/story1_section2_option1_text"/>
                <option section="3" text="@string/story1_section2_option2_text"/>
            </options>
        </section>
        <section position="3" text="@string/story1_section3_text">
            <options>
                <option section="2" text="@string/story1_section1_option1_text"/>
                <option section="" text="@string/story1_section1_option2_text"/>
                <option section="" text="@string/story1_section1_option3_text"/>
            </options>
        </section>
        <section position="4" text="@string/story1_section4_text">
            <options>
                <option section="5" text="@string/story1_section4_option1_text"/>
                <option section="3" text="@string/story1_section4_option2_text"/>
            </options>
        </section>
    </sections>
</story>