<?xml version="1.0" encoding="UTF-8"?>
<story xmlns:xsi="http://www.w3.org/2001/XMLSchema-instance" xmlns:xi="http://www.w3.org/2001/XInclude"
    xsi:noNamespaceSchemaLocation="../../story.xsd">
    <background>@drawable/zombie</background>
    <version>0</version>
    <include name="enemies/easy_enemies.xml"/>
    <include name="enemies/hard_enemies.xml"/>
    <include name="enemies/mini_bosses.xml"/>
    <include name="characters.xml"/>
    <include name="characters_lines/soldier_story_line.xml"/>
    <include name="shared_lines/kaltul_highway_story_line.xml"/>
</story>